{
  "schema_version": "0.1",
  "publication": "Korea Theme-to-Cash-Flow Agent Benchmark",
  "generated_at": "2026-05-02T19:46:52.578776+00:00",
  "last_reviewed_at": "2026-05-02",
  "refresh_policy": "Refresh when Korean filings, liquidity, source claims, or benchmark task contracts change; otherwise re-audit monthly.",
  "stale_zones": [
    "KRX/KIND/DART filing state",
    "liquidity/depth",
    "company disclosures",
    "market prices"
  ],
  "default_freshness_window_days": 30
}
