{
  "schema_version": "0.1",
  "publication": "Samsung 005930 HBM Margin Inflection Thesis",
  "generated_at": "2026-05-02T20:20:07.504030+00:00",
  "last_reviewed_at": "2026-05-02",
  "refresh_policy": "Refresh when source filings, claims, or task contracts change; otherwise re-audit monthly.",
  "stale_zones": [
    "market data",
    "filing status",
    "liquidity/depth",
    "company disclosures"
  ],
  "default_freshness_window_days": 30
}
