{
  "schema_version": "0.1",
  "publication": "SEMICON-DRA DRAM Cycle Trough Recovery Thesis",
  "generated_at": "2026-05-02T22:47:11.999865+00:00",
  "last_reviewed_at": "2026-05-02",
  "refresh_policy": "Refresh when source filings, claims, or task contracts change; otherwise re-audit monthly.",
  "stale_zones": [
    "DRAM spot pricing",
    "HBM demand/capacity mix",
    "OEM/server inventory",
    "China capacity additions"
  ],
  "default_freshness_window_days": 14
}
