{
  "schema_version": "0.1",
  "publication": "KB-FINRATE Korean Bank NIM Compression Thesis",
  "generated_at": "2026-05-02T22:26:37.910248+00:00",
  "last_reviewed_at": "2026-05-02",
  "refresh_policy": "Refresh when source filings, claims, or task contracts change; otherwise re-audit monthly.",
  "stale_zones": [
    "BOK base-rate path",
    "quarterly NIM disclosures",
    "deposit/funding mix",
    "fee income and credit costs"
  ],
  "default_freshness_window_days": 14
}
